{
  "$schema": "./core-fixture-conformance.schema.json",
  "schemaVersion": 1,
  "source": "spec/core-conformance.json",
  "supportedLayers": ["parse", "resolve", "validate", "ir"],
  "requiredKinds": ["positive", "negative", "ir", "compatibility"],
  "evidenceCatalog": {
    "positive-core": [
      {"path": "fixtures/valid/m4-minimal/app.aidl", "type": "fixture"},
      {"path": "tools/test_m5_fixture_corpus.py", "type": "test"},
      {"path": "tools/test_core_domain_type_ir_semantics.py", "type": "test"},
      {"path": "tools/test_core_enum_ir_semantics.py", "type": "test"},
      {"path": "tools/test_core_event_ir_semantics.py", "type": "test"},
      {"path": "tools/test_core_topic_materialization_contract.py", "type": "test"}
    ],
    "negative-core": [
      {"path": "tools/test_aidl_check.py", "type": "test"},
      {"path": "tools/test_compiler_diagnostics.py", "type": "test"},
      {"path": "tools/test_compiler_diagnostics_m2_02.py", "type": "test"},
      {"path": "tools/test_compiler_diagnostics_m2_03.py", "type": "test"},
      {"path": "tools/test_compiler_diagnostics_m2_04.py", "type": "test"},
      {"path": "tools/test_compiler_diagnostics_m2_05.py", "type": "test"},
      {"path": "tools/test_compiler_diagnostics_m2_08.py", "type": "test"},
      {"path": "tools/test_compiler_diagnostics_m2_09.py", "type": "test"},
      {"path": "tools/test_compiler_diagnostics_m2_10.py", "type": "test"},
      {"path": "tools/test_core_domain_type_ir_semantics.py", "type": "test"},
      {"path": "tools/test_core_enum_ir_semantics.py", "type": "test"},
      {"path": "tools/test_core_event_ir_semantics.py", "type": "test"},
      {"path": "tools/test_core_topic_materialization_contract.py", "type": "test"},
      {"path": "tools/test_core_typecheck.py", "type": "test"}
    ],
    "ir-core": [
      {"path": "fixtures/valid/m4-minimal/snapshots/ir.json", "type": "snapshot"},
      {"path": "tools/test_core_api_contract_semantics.py", "type": "test"},
      {"path": "tools/test_core_consumer_idempotency_semantics.py", "type": "test"},
      {"path": "tools/test_core_domain_type_ir_semantics.py", "type": "test"},
      {"path": "tools/test_core_entity_ownership_semantics.py", "type": "test"},
      {"path": "tools/test_core_enum_ir_semantics.py", "type": "test"},
      {"path": "tools/test_core_event_ir_semantics.py", "type": "test"},
      {"path": "tools/test_core_topic_materialization_contract.py", "type": "test"},
      {"path": "tools/test_ir_semantic_projection.py", "type": "test"}
    ],
    "compatibility-core": [
      {"path": "tools/ir_compatibility_contract/matrix.json", "type": "matrix"},
      {"path": "tools/test_ir_compatibility.py", "type": "test"}
    ]
  },
  "defaultEvidence": {
    "positive": ["positive-core"],
    "negative": ["negative-core"],
    "ir": ["ir-core"],
    "compatibility": ["compatibility-core"]
  },
  "featureIds": [
    "decl.alias",
    "decl.api",
    "decl.entity",
    "decl.enum",
    "decl.event",
    "decl.mutation",
    "decl.opaque",
    "decl.query",
    "decl.service",
    "decl.topic",
    "decl.transaction",
    "rule.api.exposure-version-compatibility",
    "rule.consumer.at-least-once",
    "rule.consumer.idempotency",
    "rule.entity.cross-service-ref-rejected",
    "rule.entity.owner-local-access",
    "rule.entity.single-owner",
    "rule.module.cyclic-dependency",
    "rule.module.duplicate-declaration",
    "rule.module.unresolved-name",
    "rule.mutation.required-clauses",
    "rule.mutation.single-root-effect",
    "rule.names.stable-fqn",
    "rule.query.side-effect-free",
    "rule.transaction.cross-resource-rejected",
    "rule.transaction.cross-service-rejected",
    "rule.transaction.outbox-atomic",
    "rule.transaction.resource-owner",
    "rule.types.int-to-decimal-only"
  ]
}
